<?xml version="1.0" encoding="utf-8"?>
<rdmPaketConfiguration xmlns:xsi="http://www.w3.org/2001/XMLSchema-instance" xsi:noNamespaceSchemaLocation="rdm_configuration_schema.xsd">
  <!-- ************************************************************* -->
  <!-- Definition/Konfiguration der Deliverables/Liefergegenstaende -->
  <!-- ************************************************************* -->
  <unused>
	<key>Andere/Produktinformation:Produktinformation/Dokumentation:Produktinf. Komponente/Inbetriebnahme:Produktinf. Komp. allgem.</key>
	<key>Andere/Produktinformation:Produktinformation/Dokumentation:Produktinf. Komponente/Integration:Produktinf. Komp. allgem.</key>
	<key>Andere/Produktinformation:Produktinformation/Dokumentation:Produktinf. Komponente/Sonstiges:Produktinf. Komp. allgem.</key>
	<key>Andere/Produktinformation:Produktinformation/Dokumentation:Produktinf. Komponente/Integration:Produktinf. Komp. allgem.</key>
	<key>Andere/Produktinformation:Produktinformation/Dokumentation:Produktinf. Komponente/Qualitaetsmanagement:Produktinf. Komp. allgem.</key>
	<key>Andere/Produktinformation:Produktinformation/Dokumentation:Produktinf. Komponente/Lieferung:Produktinf. Komp. allgem./Batchdokumentation:Produktinf. Komp. allgem.</key>
	<key>Andere/Produktinformation:Produktinformation/Dokumentation:Produktinf. Komponente/Lieferung:Produktinf. Komp. allgem./Produktionsfreigabe:Produktinf. Komp. allgem.</key>
	<key>Andere/Produktinformation:Produktinformation/Dokumentation:Produktinf. Komponente/Lieferung:Produktinf. Komp. allgem./RDM Fragenkatalog:RDM Fragenkatalog</key>
	<key>Andere/Produktinformation:Produktinformation/Dokumentation:Produktinf. Komponente/Lieferung:Produktinf. Komp. allgem./Schnittstellendokumentation:Produktinf. Komp. allgem.</key>
	<key>Andere/Produktinformation:Produktinformation/Dokumentation:Produktinf. Komponente/Lieferung:Produktinf. Komp. allgem./Sonstige Dokumentation:Produktinf. Komp. allgem.</key>
	<key>Andere/Produktinformation:Produktinformation/Dokumentation:Produktinf. Komponente/Lieferung:Produktinf. Komp. allgem./SW Architekturdiagramm:SW Architektur</key>
	<key>Andere/Produktinformation:Produktinformation/Dokumentation:Produktinf. Komponente/Lieferung:Produktinf. Komp. allgem./Technische Releasenotes:Release Notes</key>
	<key>Andere/Produktinformation:Produktinformation/Dokumentation:Produktinf. Komponente/Umgebungsmanagement:Produktinf. Komp. allgem./IBN Drehbuch:IBN Drehbuch</key>
	<key>Andere/Produktinformation:Produktinformation/Dokumentation:Produktinf. Komponente/Umgebungsmanagement:Produktinf. Komp. allgem./IBN Fragenkatalog:IBN Fragenkatalog</key>
	<key>Andere/Produktinformation:Produktinformation/Dokumentation:Produktinf. Komponente/Umgebungsmanagement:Produktinf. Komp. allgem./Konfigurationskonzept:Konfigurationskonzept</key>
	<key>Andere/Produktinformation:Produktinformation/Dokumentation:Produktinf. Komponente/Umgebungsmanagement:Produktinf. Komp. allgem./SLA Anforderungen:SLA Anforderung</key>
	<key>Andere/Produktinformation:Produktinformation/Dokumentation:Produktinf. Komponente/Umgebungsmanagement:Produktinf. Komp. allgem./Supportkonzept:Supportkonzept</key>
	<key>Andere/Produktversion:Produktversion/Servicekatalog:Servicekatalog</key>
	<key>Andere/Produktversion:Produktversion/Abhängigkeiten:Applikationskomponente allgemein</key>
	<key>Andere/Produktversion:Produktversion/Abhängigkeiten:Applikationskomponente allgemein/Produktabhängigkeiten:Produktabhängigkeit</key>
	<key>Andere/Produktversion:Produktversion/Abhängigkeiten:Applikationskomponente allgemein/Serviceabhängigkeiten:Serviceabhängigkeit</key>
	<key>Andere/Produktversion:Produktversion/Abhängigkeiten:Applikationskomponente allgemein/Umgebungsabhängigkeiten:Umgebungsabhängigkeit</key>
  </unused>
  <!-- frontend -->
  <deliverable>
	<key>Andere/Produktversion:Produktversion/Frontend:Applikationskomponente allgemein</key>
	<artifact id="focus.frontend">
	  <groupId>at.sozvers.noegkk.focus</groupId>
	  <artifactId>focus-frontend-eportal</artifactId>
	  <classifier>delivery</classifier>
	  <type>zip</type>
	</artifact>
  </deliverable>
  <!-- db -->
  <deliverable>
	<key>Andere/Produktversion:Produktversion/Datenbank:Applikationskomponente allgemein</key>
	<artifact id="focus.db">
	  <groupId>at.sozvers.noegkk.focus</groupId>
	  <artifactId>focus-db-delivery</artifactId>
	  <classifier>db-delivery</classifier>
	  <type>zip</type>
	</artifact>
  </deliverable>
  <!-- fachliche releasenotes -->
  <deliverable>
	<key>Andere/Produktinformation:Produktinformation/Dokumentation:Produktinf. Komponente/Lieferung:Produktinf. Komp. allgem./Fachliche Releasenotes:Release Notes</key>
	<artifact id="focus.release.notes">
	  <groupId>at.sozvers.noegkk.focus</groupId>
	  <artifactId>focus-doc</artifactId>
	  <classifier>release-notes</classifier>
	  <type>pdf</type>
	</artifact>
  </deliverable>
  <!-- Installationshandbuch -->
  <deliverable>
	<key>Andere/Produktinformation:Produktinformation/Dokumentation:Produktinf. Komponente/Umgebungsmanagement:Produktinf. Komp. allgem./Installationshandbuch:Installationshandbuch</key>
	<artifact id="focus.install.manual">
	  <groupId>at.sozvers.noegkk.focus</groupId>
	  <artifactId>focus-doc</artifactId>
	  <classifier>install-manual</classifier>
	  <type>pdf</type>
	</artifact>
  </deliverable>
  <!-- ************************************************************* -->
  <!-- Workflow Definition -->
  <!-- ************************************************************* -->
  <workflow id="focus.workflow.lieferung">
	<name>FOCUS360 Lieferworkflow</name>
	<abschnitt>Lieferung</abschnitt>
  </workflow>
</rdmPaketConfiguration>